{
  "version": "0.1",
  "action": "BLOCK",
  "statusCode": 403,
  "reason": "Policy violation",
  "ruleHits": [
    {
      "id": "contract.reject_unknown_fields",
      "severity": "high",
      "message": "Unknown fields present"
    }
  ],
  "risk": {
    "score": 60,
    "level": "high"
  },
  "redactions": []
}
